{
  "schema_version": "1.0.0",
  "contract_kind": "HUMAN_ORDINAL_TEST_ORACLE",
  "ontology_version": "1.0.0",
  "oracle_id": "ORACLE-ATTENTION-T1-AFTER",
  "snapshot_role": "T1",
  "expected_ordered_items": [
    {
      "expected_rank": 1,
      "stable_attention_item_reference": "ATTN-CMT-01",
      "ordinal_invariants": [
        "CMT-01 enters only after the trigger.",
        "BUILD_FIRST requires CMT-01 above CMT-02."
      ],
      "expected_score_direction": "NEW_ENTRY",
      "evidence_refs": [
        "EV-EVENT-TRIGGER",
        "EV-COMMITMENT-APPROVAL",
        "EV-HUMAN-EXPECTATION"
      ],
      "expected_protected_references": [
        "CMT-01"
      ],
      "expected_displaced_references": [],
      "expected_uncertainty": [
        "Official requirements and exact demonstration scope remain unverified."
      ],
      "expected_approval_requirement": "NOT_REQUIRED",
      "approval_authority": "FOUNDER",
      "explanation": "The minimum verifiable end-to-end product demonstration enters at rank 1."
    },
    {
      "expected_rank": 2,
      "stable_attention_item_reference": "ATTN-CMT-02",
      "ordinal_invariants": [
        "CMT-02 enters only after the trigger.",
        "CMT-02 depends_on CMT-01 and remains a distinct protected commitment."
      ],
      "expected_score_direction": "NEW_ENTRY",
      "evidence_refs": [
        "EV-EVENT-TRIGGER",
        "EV-COMMITMENT-APPROVAL",
        "EV-HUMAN-EXPECTATION"
      ],
      "expected_protected_references": [
        "CMT-02"
      ],
      "expected_displaced_references": [],
      "expected_uncertainty": [
        "Live submission state and exact missing requirements remain unknown."
      ],
      "expected_approval_requirement": "NOT_REQUIRED",
      "approval_authority": "FOUNDER",
      "explanation": "The distinct minimum submission package enters at rank 2 after the substantive demonstration path."
    },
    {
      "expected_rank": 3,
      "stable_attention_item_reference": "ATTN-CALENDAR-CMT-T0-10",
      "ordinal_invariants": [
        "Protected personal and legal continuity remains in the top three.",
        "Protected work is not displaced by the trigger."
      ],
      "expected_score_direction": "DECREASE",
      "evidence_refs": [
        "EV-CAL-CMT-T0-10",
        "EV-HUMAN-EXPECTATION"
      ],
      "expected_protected_references": [
        "CMT-T0-10"
      ],
      "expected_displaced_references": [],
      "expected_uncertainty": [
        "The exact external deadline remains unknown."
      ],
      "expected_approval_requirement": "NOT_REQUIRED",
      "approval_authority": "FOUNDER",
      "explanation": "The protected Calendar-only continuity item moves from rank 1 to rank 3 without losing protection."
    },
    {
      "expected_rank": 4,
      "stable_attention_item_reference": "ATTN-CMT-03",
      "ordinal_invariants": [
        "CMT-03 remains visible.",
        "The trigger cannot silently erase an unresolved carryover."
      ],
      "expected_score_direction": "DECREASE",
      "evidence_refs": [
        "EV-CAL-CMT-T0-02",
        "EV-COMMITMENT-APPROVAL",
        "EV-HUMAN-EXPECTATION"
      ],
      "expected_protected_references": [],
      "expected_displaced_references": [],
      "expected_uncertainty": [
        "External response and resolution remain unknown."
      ],
      "expected_approval_requirement": "NOT_REQUIRED",
      "approval_authority": "FOUNDER",
      "explanation": "The unresolved continuity obligation remains visible and moves from rank 2 to rank 4."
    },
    {
      "expected_rank": 5,
      "stable_attention_item_reference": "ATTN-CMT-05",
      "ordinal_invariants": [
        "CMT-05 remains NEEDS_CONFIRMATION.",
        "No automatic movement or release is authorized."
      ],
      "expected_score_direction": "DECREASE",
      "evidence_refs": [
        "EV-CAL-CMT-T0-04",
        "EV-CAL-CMT-T0-05",
        "EV-COMMITMENT-APPROVAL",
        "EV-HUMAN-EXPECTATION"
      ],
      "expected_protected_references": [],
      "expected_displaced_references": [],
      "expected_uncertainty": [
        "The joint-authority outcome and release state remain unknown."
      ],
      "expected_approval_requirement": "PENDING",
      "approval_authority": "JOINT",
      "explanation": "The aggregated Shared release-readiness gate remains confirmation-dependent and moves from rank 3 to rank 5."
    },
    {
      "expected_rank": 6,
      "stable_attention_item_reference": "ATTN-CALENDAR-CMT-T0-01",
      "ordinal_invariants": [
        "The Calendar-only collaboration decision remains represented.",
        "No automatic movement is authorized."
      ],
      "expected_score_direction": "DECREASE",
      "evidence_refs": [
        "EV-CAL-CMT-T0-01",
        "EV-HUMAN-EXPECTATION"
      ],
      "expected_protected_references": [],
      "expected_displaced_references": [],
      "expected_uncertainty": [
        "The other authority holder's availability remains unknown."
      ],
      "expected_approval_requirement": "PENDING",
      "approval_authority": "JOINT",
      "explanation": "The confirmation-dependent Calendar-only item moves from rank 4 to rank 6 without disappearing."
    },
    {
      "expected_rank": 7,
      "stable_attention_item_reference": "ATTN-CMT-04",
      "ordinal_invariants": [
        "CMT-04 is the only conditionally displaced commitment.",
        "Expected conditional displacement does not prove execution."
      ],
      "expected_score_direction": "DECREASE",
      "evidence_refs": [
        "EV-CAL-CMT-T0-03",
        "EV-COMMITMENT-APPROVAL",
        "EV-HUMAN-EXPECTATION"
      ],
      "expected_protected_references": [],
      "expected_displaced_references": [
        "CMT-04"
      ],
      "expected_uncertainty": [
        "Actual execution, repair slot, and reactivation condition remain unknown."
      ],
      "expected_approval_requirement": "APPROVED",
      "approval_authority": "FOUNDER",
      "explanation": "The approved oracle moves Pending bounded validation (CMT-04) from rank 5 to rank 7 conditionally; no movement is recorded as executed."
    },
    {
      "expected_rank": 8,
      "stable_attention_item_reference": "ATTN-CALENDAR-CMT-T0-06",
      "ordinal_invariants": [
        "Flexible Calendar capacity remains visible.",
        "A capacity conflict does not prove displacement."
      ],
      "expected_score_direction": "DECREASE",
      "evidence_refs": [
        "EV-CAL-CMT-T0-06",
        "EV-HUMAN-EXPECTATION"
      ],
      "expected_protected_references": [],
      "expected_displaced_references": [],
      "expected_uncertainty": [
        "Data access and implementation authority remain unknown."
      ],
      "expected_approval_requirement": "NOT_REQUIRED",
      "approval_authority": "FOUNDER",
      "explanation": "The Calendar-only operating block moves from rank 6 to rank 8 and remains represented."
    },
    {
      "expected_rank": 9,
      "stable_attention_item_reference": "ATTN-CALENDAR-CMT-T0-09",
      "ordinal_invariants": [
        "Flexible Calendar capacity remains visible.",
        "No T0 obligation silently disappears."
      ],
      "expected_score_direction": "DECREASE",
      "evidence_refs": [
        "EV-CAL-CMT-T0-09",
        "EV-HUMAN-EXPECTATION"
      ],
      "expected_protected_references": [],
      "expected_displaced_references": [],
      "expected_uncertainty": [
        "Input readiness and later completion remain unknown."
      ],
      "expected_approval_requirement": "NOT_REQUIRED",
      "approval_authority": "FOUNDER",
      "explanation": "The Calendar-only consolidation block moves from rank 7 to rank 9 and remains represented."
    }
  ],
  "ordinal_invariants": [
    "CMT-01 enters at rank 1 and CMT-02 enters at rank 2.",
    "CMT-01 ranks above CMT-02 and CMT-02 depends_on CMT-01.",
    "CMT-01 and CMT-02 are distinct and both are top-three.",
    "Protected personal and legal continuity remains at rank 3.",
    "CMT-03 remains visible.",
    "CMT-04 is the only conditional displacement and is not marked executed.",
    "CMT-05 remains confirmation-required under JOINT authority.",
    "CMT-T0-07 and CMT-T0-08 remain excluded but retained.",
    "No T0 obligation silently disappears.",
    "No production score or computed tie-break result is asserted."
  ],
  "human_authored_provenance": {
    "provenance_id": "PROV-ORACLE-T1",
    "source_class": "EXPLICIT_HUMAN_INPUT",
    "evidence_category": "HUMAN_EXPECTATION",
    "artifact_reference": "HA-LANE-A-FOUNDER-APPROVAL",
    "authority_scope": "EXPLICIT_HUMAN_DECISION",
    "source_derived": true,
    "transformation_action": "SYNTHESIZE",
    "reversible": false
  },
  "approval_artifact_reference": "HA-LANE-A-FOUNDER-APPROVAL",
  "privacy_classification": "PUBLIC_SAFE",
  "privacy_review_state": "APPROVED_WITH_TRANSFORMATIONS",
  "created_at": "2030-02-10T13:00:00Z"
}
